<?xml version="1.0" encoding="UTF-8"?>
<simulation xmlns:xsi="http://www.w3.org/2001/XMLSchema-instance" xsi:noNamespaceSchemaLocation="../src/io/input/XMLFormat.xsd">

    <boundaries>
        <left>outflow</left>
        <right>outflow</right>
        <bottom>periodic</bottom>
        <top>periodic</top>
        <rear>periodic</rear>
        <front>periodic</front>
    </boundaries>

    <inputSettings>
        <inputFile>../input/generated-input.txt</inputFile>
    </inputSettings>

    <outputSettings>
        <baseName>ass5_task4</baseName>
        <writeFrequency>100</writeFrequency>
    </outputSettings>

    <simulationParameters>
        <end_t>500</end_t>
        <delta_t>0.0005</delta_t>
        <start_t>0.0</start_t>
        <force>lennardJonesForce</force>
        <algorithm>linkedcell</algorithm>
        <loglevel>INFO</loglevel>
        <domain>
            <x>30.0</x>
            <y>30.0</y>
            <z>12.0</z>
        </domain>
        <domain_start>
            <x>0.0</x>
            <y>0.0</y>
            <z>0.0</z>
        </domain_start>
        <cutoff_radius>2.5</cutoff_radius>
        <grav_constant>-0.8</grav_constant>
        <walls_flag>true</walls_flag>
    </simulationParameters>

    <thermostat>
        <T_init>40</T_init>
        <n_thermostat>10</n_thermostat>
        <brownian_motion_dimension>3</brownian_motion_dimension>
    </thermostat>

     <cuboid>
        <position>
            <x>1.0</x>
            <y>0.5</y>
            <z>0.5</z>
        </position>
        <velocity>
            <x>0.0</x>
            <y>0.0</y>
            <z>0.0</z>
        </velocity>
        <dimensions>
            <x>2</x>
            <y>30</y>
            <z>12</z>
        </dimensions>
        <distance>1.0</distance>
        <mass>1.0</mass>
        <brownian_motion>0.0</brownian_motion>
        <epsilon>2.0</epsilon>
        <sigma>1.1</sigma>
        <brownian_motion_dimension>3</brownian_motion_dimension>
        <type>0</type>
        <is_outer>true</is_outer>
    </cuboid>


     <cuboid>
        <position>
            <x>27.2</x>
            <y>0.5</y>
            <z>0.5</z>
        </position>
        <velocity>
            <x>0.0</x>
            <y>0.0</y>
            <z>0.0</z>
        </velocity>
        <dimensions>
            <x>2</x>
            <y>30</y>
            <z>12</z>
        </dimensions>
        <distance>1.0</distance>
        <mass>1.0</mass>
        <brownian_motion>0.0</brownian_motion>
        <epsilon>2.0</epsilon>
        <sigma>1.1</sigma>
        <brownian_motion_dimension>3</brownian_motion_dimension>
        <type>1</type>
        <is_outer>true</is_outer>
    </cuboid>

    
     <cuboid>
        <position>
            <x>3.2</x>
            <y>0.6</y>
            <z>0.6</z>
        </position>
        <velocity>
            <x>0.0</x>
            <y>0.0</y>
            <z>0.0</z>
        </velocity>
        <dimensions>
            <x>20</x>
            <y>25</y>
            <z>10</z>
        </dimensions>
        <distance>1.2</distance>
        <mass>1.0</mass>
        <brownian_motion>0.0</brownian_motion>
        <epsilon>1.0</epsilon>
        <sigma>1.0</sigma>
        <brownian_motion_dimension>3</brownian_motion_dimension>
        <type>2</type>
        <is_outer>false</is_outer>
    </cuboid>

</simulation>
