<?xml version="1.0" encoding="UTF-8"?>
<simulation xmlns:xsi="http://www.w3.org/2001/XMLSchema-instance" xsi:noNamespaceSchemaLocation="../src/io/input/XMLFormat.xsd">

    <boundaries>
        <left>reflecting</left>
        <right>reflecting</right>
        <bottom>reflecting</bottom>
        <top>reflecting</top>
        <rear>reflecting</rear>
        <front>reflecting</front>
    </boundaries>

    <inputSettings>
        <inputFile>../input/generated-input.txt</inputFile>
    </inputSettings>

    <outputSettings>
        <baseName>ass3_task4</baseName>
        <writeFrequency>200</writeFrequency>
    </outputSettings>

    <simulationParameters>
        <end_t>10.0</end_t>
        <delta_t>0.00005</delta_t>
        <start_t>0.0</start_t>
        <force>lennardJonesForce</force>
        <algorithm>linkedcell</algorithm>
        <loglevel>INFO</loglevel>
        <domain>
            <x>120.0</x>
            <y>50.0</y>
            <z>1.0</z>
        </domain>
        <domain_start>
            <x>0.0</x>
            <y>0.0</y>
            <z>0.0</z>
        </domain_start>
        <cutoff_radius>3.0</cutoff_radius>
        <grav_constant>0</grav_constant>
    </simulationParameters>

    <disc>
        <position>
            <x>60.0</x>
            <y>25.0</y>
            <z>0.0</z>
        </position>
        <velocity>
            <x>0.0</x>
            <y>-10.0</y>
            <z>0.0</z>
        </velocity>
        <radius>15</radius>
        <distance>1.1225</distance>
        <mass>1.0</mass>
        <epsilon>5.0</epsilon>
        <sigma>1.0</sigma>
        <type>1</type>
    </disc>

</simulation>
