<?xml version="1.0" encoding="UTF-8"?>
<simulation xmlns:xsi="http://www.w3.org/2001/XMLSchema-instance"
            xsi:noNamespaceSchemaLocation="../src/io/input/XMLFormat.xsd">

    <!-- Output settings -->
    <outputSettings>
        <baseName>MD_vtk</baseName>
        <writeFrequency>100</writeFrequency>
    </outputSettings>

    <!-- Simulation parameters -->
    <simulationParameters>
        <end_t>5.0</end_t>
        <delta_t>0.0002</delta_t>
        <start_t>0.0</start_t>
    </simulationParameters>

    <!-- Cuboids -->
    <cuboid>
        <position>
            <x>0.0</x>
            <y>0.0</y>
            <z>0.0</z>
        </position>
        <velocity>
            <x>0.0</x>
            <y>0.0</y>
            <z>0.0</z>
        </velocity>
        <dimensions>
            <x>40</x>
            <y>8</y>
            <z>1</z>
        </dimensions>
        <distance>1.1225</distance>
        <mass>1</mass>
    </cuboid>

    <cuboid>
        <position>
            <x>15.0</x>
            <y>15.0</y>
            <z>0.0</z>
        </position>
        <velocity>
            <x>0.0</x>
            <y>-10.0</y>
            <z>0.0</z>
        </velocity>
        <dimensions>
            <x>8</x>
            <y>8</y>
            <z>1</z>
        </dimensions>
        <distance>1.1225</distance>
        <mass>1</mass>
    </cuboid>

    <!-- Add more cuboids if necessary -->

</simulation>
