<?xml version="1.0" encoding="UTF-8"?>
<simulation xmlns:xsi="http://www.w3.org/2001/XMLSchema-instance" xsi:noNamespaceSchemaLocation="../src/io/input/XMLFormat.xsd">

    <boundaries>
        <left>periodic</left>
        <right>periodic</right>
        <bottom>reflecting</bottom>
        <top>reflecting</top>
        <rear>outflow</rear>
        <front>outflow</front>
    </boundaries>

    <inputSettings>
        <inputFile>../input/generated-input.txt</inputFile>
    </inputSettings>

    <outputSettings>
        <baseName>ass4_task2_1</baseName>
        <writeFrequency>100</writeFrequency>
    </outputSettings>

    <simulationParameters>
        <end_t>25</end_t>
        <delta_t>0.0005</delta_t>
        <start_t>0.0</start_t>
        <force>lennardJonesForce</force>
        <algorithm>linkedcell</algorithm>
        <loglevel>INFO</loglevel>
        <domain>
            <x>63.0</x>
            <y>36.0</y>
            <z>1</z>
        </domain>
        <domain_start>
            <x>0.0</x>
            <y>0.0</y>
            <z>0.0</z>
        </domain_start>
        <cutoff_radius>2.5</cutoff_radius>
        <grav_constant>
            <x>0.0</x>
            <y>-12.44</y>
            <z>0.0</z>
        </grav_constant>
        <walls_flag>false</walls_flag>
    </simulationParameters>

    <thermostat>
        <T_init>40</T_init>
        <n_thermostat>1000</n_thermostat>
        <brownian_motion_dimension>2</brownian_motion_dimension>
    </thermostat>

    <openmp>
        <num_threads>4</num_threads>
        <parallelizationstrategy>second</parallelizationstrategy>
    </openmp>

    <cuboid>
        <position>
            <x>0.6</x>
            <y>2.0</y>
            <z>0.0</z>
        </position>
        <velocity>
            <x>0.0</x>
            <y>0.0</y>
            <z>0.0</z>
        </velocity>
        <dimensions>
            <x>50</x>
            <y>14</y>
            <z>1</z>
        </dimensions>
        <distance>1.2</distance>
        <mass>1.0</mass>
        <brownian_motion>0.1</brownian_motion>
        <epsilon>1.0</epsilon>
        <sigma>1.0</sigma>
        <brownian_motion_dimension>2</brownian_motion_dimension>
        <type>1</type> 
        <is_outer>false</is_outer>
    </cuboid>

    <cuboid>
        <position>
            <x>0.6</x>
            <y>19.0</y>
            <z>0.0</z>
        </position>
        <velocity>
            <x>0.0</x>
            <y>0.0</y>
            <z>0.0</z>
        </velocity>
        <dimensions>
            <x>50</x>
            <y>14</y>
            <z>1</z>
        </dimensions>
        <distance>1.2</distance>
        <mass>2.0</mass>
        <brownian_motion>0.1</brownian_motion>
        <epsilon>1.0</epsilon>
        <sigma>0.9412</sigma>
        <brownian_motion_dimension>2</brownian_motion_dimension>
        <type>2</type> 
        <is_outer>false</is_outer>
    </cuboid>

</simulation>
