<?xml version="1.0" encoding="UTF-8"?>
<simulation xmlns:xsi="http://www.w3.org/2001/XMLSchema-instance" xsi:noNamespaceSchemaLocation="../src/io/input/XMLFormat.xsd">

    <boundaries>
        <left>reflecting</left>
        <right>reflecting</right>
        <bottom>reflecting</bottom>
        <top>reflecting</top>
        <rear>reflecting</rear>
        <front>reflecting</front>
    </boundaries>

    <inputSettings>
        <inputFile>../input/generated-input.txt</inputFile>
    </inputSettings>

    <outputSettings>
        <baseName>drop_in_glass</baseName>
        <writeFrequency>100</writeFrequency>
    </outputSettings>

    <simulationParameters>
        <end_t>20.0</end_t>
        <delta_t>0.0005</delta_t>
        <start_t>0.0</start_t>
        <force>lennardJonesForce</force>
        <algorithm>linkedcell</algorithm>
        <loglevel>INFO</loglevel>
        <domain>
            <x>60.0</x>
            <y>60.0</y>
            <z>1.0</z>
        </domain>
        <domain_start>
            <x>0.0</x>
            <y>0.0</y>
            <z>0.0</z>
        </domain_start>
        <cutoff_radius>3.0</cutoff_radius>
        <grav_constant>0</grav_constant>
    </simulationParameters>

    <cuboid>
        <position>
            <x>18.8775</x>
            <y>20.0</y>
            <z>0.0</z>
        </position>
        <velocity>
            <x>0.0</x>
            <y>0.0</y>
            <z>0.0</z>
        </velocity>
        <dimensions>
            <x>1</x>
            <y>25</y>
            <z>1</z>
        </dimensions>
        <distance>1.1225</distance>
        <mass>1000000000000000</mass>
        <brownian_motion>0.0</brownian_motion>
        <epsilon>5.0</epsilon>
        <sigma>1.0</sigma>
    </cuboid>

    <cuboid>
        <position>
            <x>20</x>
            <y>20.0</y>
            <z>0.0</z>
        </position>
        <velocity>
            <x>0.0</x>
            <y>0.0</y>
            <z>0.0</z>
        </velocity>
        <dimensions>
            <x>21</x>
            <y>1</y>
            <z>1</z>
        </dimensions>
        <distance>1.1225</distance>
        <mass>1000000000000000</mass>
        <brownian_motion>0.0</brownian_motion>
        <epsilon>5.0</epsilon>
        <sigma>1.0</sigma>
    </cuboid>

    <cuboid>
        <position>
            <x>43.5725</x>
            <y>20.0</y>
            <z>0.0</z>
        </position>
        <velocity>
            <x>0.0</x>
            <y>0.0</y>
            <z>0.0</z>
        </velocity>
        <dimensions>
            <x>1</x>
            <y>25</y>
            <z>1</z>
        </dimensions>
        <distance>1.1225</distance>
        <mass>1000000000000000</mass>
        <brownian_motion>0.0</brownian_motion>
        <epsilon>5.0</epsilon>
        <sigma>1.0</sigma>
    </cuboid>

    <disc>
        <position>
            <x>31.225</x>
            <y>50.0</y>
            <z>0.0</z>
        </position>
        <velocity>
            <x>0.0</x>
            <y>-10.0</y>
            <z>0.0</z>
        </velocity>
        <radius>8</radius>
        <distance>1.1225</distance>
        <mass>1.0</mass>
        <epsilon>5.0</epsilon>
        <sigma>1.0</sigma>
    </disc>

</simulation>
